{
  "schemaVersion": "2.0.0",
  "graph": {
    "rootEntityId": "repo:github:grpc/grpc",
    "provider": "github",
    "revision": {
      "commit": "724b3ccb608b8ac7e51482a15113edfd94bb28ba",
      "defaultBranch": "master",
      "resolvedAt": "2026-10-03T07:27:10.950Z"
    },
    "generatedAt": "2026-10-03T07:27:10.950Z",
    "analyzer": {
      "name": "gitlineage-analyzer",
      "version": "0.2.0",
      "schemaVersion": "2.0.0",
      "namespace": "public",
      "extractors": [
        "explicit-attribution@1",
        "explicit-reference@1",
        "git-blob-identity@1",
        "github-fork-metadata@1",
        "github-repository-identity@1",
        "gitmodules-entry@1",
        "lockfile-dependency@1",
        "manifest-dependency@1",
        "package-registry-metadata@1"
      ],
      "adapters": [
        "package-registry"
      ],
      "limitsApplied": {
        "history_depth": 200,
        "tree_entries": 120000,
        "document_bytes": 262144,
        "manifest_bytes": 2097152,
        "dependency_facts": 400,
        "registry_lookups": 25,
        "candidate_count": 12
      }
    }
  },
  "entities": [
    {
      "id": "pkg:pypi:build",
      "type": "Package",
      "display": {
        "name": "build",
        "fullName": "pypi:build"
      },
      "attributes": {}
    },
    {
      "id": "pkg:pypi:coverage",
      "type": "Package",
      "display": {
        "name": "coverage",
        "fullName": "pypi:coverage"
      },
      "attributes": {}
    },
    {
      "id": "pkg:pypi:cython",
      "type": "Package",
      "display": {
        "name": "cython",
        "fullName": "pypi:cython"
      },
      "attributes": {}
    },
    {
      "id": "pkg:pypi:setuptools",
      "type": "Package",
      "display": {
        "name": "setuptools",
        "fullName": "pypi:setuptools"
      },
      "attributes": {}
    },
    {
      "id": "pkg:pypi:typing-extensions",
      "type": "Package",
      "display": {
        "name": "typing-extensions",
        "fullName": "pypi:typing-extensions"
      },
      "attributes": {}
    },
    {
      "id": "pkg:pypi:wheel",
      "type": "Package",
      "display": {
        "name": "wheel",
        "fullName": "pypi:wheel"
      },
      "attributes": {}
    },
    {
      "id": "repo:github:abseil/abseil-cpp",
      "type": "Repository",
      "display": {
        "name": "abseil-cpp",
        "fullName": "abseil/abseil-cpp",
        "url": "https://github.com/abseil/abseil-cpp"
      },
      "attributes": {
        "created_at": "2017-09-20T15:10:30Z",
        "default_branch": "master",
        "full_name": "abseil/abseil-cpp",
        "is_fork": false,
        "provider": "github",
        "url": "https://github.com/abseil/abseil-cpp"
      },
      "sourceUrl": "https://github.com/abseil/abseil-cpp"
    },
    {
      "id": "repo:github:c-ares/c-ares",
      "type": "Repository",
      "display": {
        "name": "c-ares",
        "fullName": "c-ares/c-ares",
        "url": "https://github.com/c-ares/c-ares"
      },
      "attributes": {
        "created_at": "2010-03-20T19:30:23Z",
        "default_branch": "main",
        "full_name": "c-ares/c-ares",
        "is_fork": false,
        "provider": "github",
        "url": "https://github.com/c-ares/c-ares"
      },
      "sourceUrl": "https://github.com/c-ares/c-ares"
    },
    {
      "id": "repo:github:cel-expr/cel-c",
      "type": "Repository",
      "display": {
        "name": "cel-c",
        "fullName": "cel-expr/cel-c",
        "url": "https://github.com/cel-expr/cel-c"
      },
      "attributes": {
        "created_at": "2026-05-15T20:44:44Z",
        "default_branch": "master",
        "full_name": "cel-expr/cel-c",
        "is_fork": false,
        "provider": "github",
        "url": "https://github.com/cel-expr/cel-c"
      },
      "sourceUrl": "https://github.com/cel-expr/cel-c"
    },
    {
      "id": "repo:github:census-instrumentation/opencensus-proto",
      "type": "Repository",
      "display": {
        "name": "opencensus-proto",
        "fullName": "census-instrumentation/opencensus-proto",
        "url": "https://github.com/census-instrumentation/opencensus-proto"
      },
      "attributes": {
        "created_at": "2016-09-01T17:16:10Z",
        "default_branch": "master",
        "full_name": "census-instrumentation/opencensus-proto",
        "is_fork": false,
        "provider": "github",
        "url": "https://github.com/census-instrumentation/opencensus-proto"
      },
      "sourceUrl": "https://github.com/census-instrumentation/opencensus-proto"
    },
    {
      "id": "repo:github:cncf/xds",
      "type": "Repository",
      "display": {
        "name": "xds",
        "fullName": "cncf/xds",
        "url": "https://github.com/cncf/xds"
      },
      "attributes": {
        "created_at": "2020-11-19T16:01:59Z",
        "default_branch": "main",
        "full_name": "cncf/xds",
        "is_fork": false,
        "provider": "github",
        "url": "https://github.com/cncf/xds"
      },
      "sourceUrl": "https://github.com/cncf/xds"
    },
    {
      "id": "repo:github:coveragepy/coveragepy",
      "type": "Repository",
      "display": {
        "name": "coveragepy",
        "fullName": "coveragepy/coveragepy",
        "url": "https://github.com/coveragepy/coveragepy"
      },
      "attributes": {
        "created_at": "2018-06-23T17:44:53Z",
        "default_branch": "main",
        "full_name": "coveragepy/coveragepy",
        "is_fork": false,
        "provider": "github",
        "url": "https://github.com/coveragepy/coveragepy"
      },
      "sourceUrl": "https://github.com/coveragepy/coveragepy"
    },
    {
      "id": "repo:github:cython/cython",
      "type": "Repository",
      "display": {
        "name": "cython",
        "fullName": "cython/cython",
        "url": "https://github.com/cython/cython"
      },
      "attributes": {
        "created_at": "2010-11-21T07:44:20Z",
        "default_branch": "master",
        "full_name": "cython/cython",
        "is_fork": false,
        "provider": "github",
        "url": "https://github.com/cython/cython"
      },
      "sourceUrl": "https://github.com/cython/cython"
    },
    {
      "id": "repo:github:envoyproxy/data-plane-api",
      "type": "Repository",
      "display": {
        "name": "data-plane-api",
        "fullName": "envoyproxy/data-plane-api",
        "url": "https://github.com/envoyproxy/data-plane-api"
      },
      "attributes": {
        "created_at": "2017-05-08T21:50:29Z",
        "default_branch": "main",
        "full_name": "envoyproxy/data-plane-api",
        "is_fork": false,
        "provider": "github",
        "url": "https://github.com/envoyproxy/data-plane-api"
      },
      "sourceUrl": "https://github.com/envoyproxy/data-plane-api"
    },
    {
      "id": "repo:github:envoyproxy/protoc-gen-validate",
      "type": "Repository",
      "display": {
        "name": "protoc-gen-validate",
        "fullName": "bufbuild/protoc-gen-validate",
        "url": "https://github.com/bufbuild/protoc-gen-validate"
      },
      "attributes": {
        "created_at": "2017-10-03T22:51:17Z",
        "default_branch": "main",
        "full_name": "bufbuild/protoc-gen-validate",
        "is_fork": false,
        "provider": "github",
        "url": "https://github.com/bufbuild/protoc-gen-validate"
      },
      "sourceUrl": "https://github.com/bufbuild/protoc-gen-validate"
    },
    {
      "id": "repo:github:fullstorydev/grpcurl",
      "type": "Repository",
      "display": {
        "name": "grpcurl",
        "fullName": "fullstorydev/grpcurl",
        "url": "https://github.com/fullstorydev/grpcurl"
      },
      "attributes": {
        "created_at": "2017-11-20T15:53:31Z",
        "default_branch": "master",
        "full_name": "fullstorydev/grpcurl",
        "is_fork": false,
        "provider": "github",
        "url": "https://github.com/fullstorydev/grpcurl"
      },
      "sourceUrl": "https://github.com/fullstorydev/grpcurl"
    },
    {
      "id": "repo:github:google/benchmark",
      "type": "Repository",
      "display": {
        "name": "benchmark",
        "fullName": "google/benchmark",
        "url": "https://github.com/google/benchmark"
      },
      "attributes": {
        "created_at": "2013-12-12T00:10:48Z",
        "default_branch": "main",
        "full_name": "google/benchmark",
        "is_fork": false,
        "provider": "github",
        "url": "https://github.com/google/benchmark"
      },
      "sourceUrl": "https://github.com/google/benchmark"
    },
    {
      "id": "repo:github:google/bloaty",
      "type": "Repository",
      "display": {
        "name": "bloaty",
        "fullName": "google/bloaty",
        "url": "https://github.com/google/bloaty"
      },
      "attributes": {
        "created_at": "2016-11-07T17:04:01Z",
        "default_branch": "main",
        "full_name": "google/bloaty",
        "is_fork": false,
        "provider": "github",
        "url": "https://github.com/google/bloaty"
      },
      "sourceUrl": "https://github.com/google/bloaty"
    },
    {
      "id": "repo:github:google/boringssl",
      "type": "Repository",
      "display": {
        "name": "boringssl",
        "fullName": "google/boringssl"
      },
      "attributes": {}
    },
    {
      "id": "repo:github:google/cel-spec",
      "type": "Repository",
      "display": {
        "name": "cel-spec",
        "fullName": "google/cel-spec"
      },
      "attributes": {}
    },
    {
      "id": "repo:github:google/googletest",
      "type": "Repository",
      "display": {
        "name": "googletest",
        "fullName": "google/googletest"
      },
      "attributes": {}
    },
    {
      "id": "repo:github:google/re2",
      "type": "Repository",
      "display": {
        "name": "re2",
        "fullName": "google/re2"
      },
      "attributes": {}
    },
    {
      "id": "repo:github:googleapis/googleapis",